"id","story","story_act","character","role","storyline_no","parenthetic","storyline_title","storyline","notes","storyweaving_scene_no","storyweaving_scene","storyweaving_sequence","storyweaving_theme","characterevent_scene","character_event","startdate","enddate","scene","sequence"
"256","2","2","13",\N,\N,\N,"scene 34: HIRZEL","The real change had to occure in our hearts, and I was so happy, that Zar Alexander supported our missionary efforts.","Chronology scene 200, 44; Morel, 1873, p. xy ",\N,\N,\N,\N,\N,\N,\N,\N,"35","38"
"257","2","2","15",\N,\N,\N,"scene 35: PARIS","What are you speaking about? Constantin: Meta was suggesting that the true story was a hidden one. Emma: You are right. I also had faught on the battle field; for the children of Liberty, for me. But the change came from within our minds, all these discussions in my saloon, this is were the new world was cemented.","Chronology scene ?? Morel, 1873, p. xy ",\N,\N,\N,\N,\N,\N,\N,\N,"36","39"
"258","2","2","15",\N,\N,\N,"scene 36: BERLIN","My salvator was Georg, his poem of a ""living man"", it gave me true life. I had been so bored and finally found purpose in his, our fight.","Chronology scene 203-204; Morel, 1873, p. xy ",\N,\N,\N,\N,\N,\N,\N,\N,"37","40"
"259","2","2","15",\N,\N,\N,"scene 37: ZÜRICH","This is why writing was important, it could change minds. But at the end, it could also be dangerous. We had to leave Zürich for it, and all my life I had to live in economic misery. The time was not ready yet, by then.","Chronology scene 209; Morel, 1873, p. xy ",\N,\N,\N,\N,\N,\N,\N,\N,"38","41"
"260","2","2","14",\N,\N,\N,"scene 38: ZÜRICH","You are brave Emma. This was my cardinal sin. I had not faith and believed that I had to take care for economic issues.","Chronology scene 180; Morel, 1873, p. xy ",\N,\N,\N,\N,\N,\N,\N,\N,"39","42"
"261","2","2","14",\N,\N,\N,"scene 39: ZÜRICH","This is were my disaster began, because I had fooled my true love; Sanskrit studies.","Chronology scene 180, 205, suicide?; Morel, 1873, p. xy ",\N,\N,\N,\N,\N,\N,\N,\N,"40","43"
"262","2","2","14",\N,\N,\N,"scene 40: ZÜRICH","The press accused me much after the Züriputsch, they blamed me for being violent and a Don Juan. But I took care for everybody and had been able to pay all my debth back. ","Chronology scene 205; Morel, 1873, p. xy ",\N,\N,\N,\N,\N,\N,\N,\N,"41","44"
"263","2","2","14",\N,\N,\N,"scene 40: ZÜRICH","If there had not been so much conspiration against me, even from my own family.",\N,\N,\N,\N,\N,\N,\N,\N,\N,"41","45"
"264","2","2","14",\N,\N,\N,"scene 41: ZÜRICH","All I had done was for love. I took the position as a parson in order to care for my young family, and I helped the village people after the fire. They loved so much for my support during the Züriputsch. Their faith was honest, and the liberals only speculated to destroy the church from within.","Chronology scene 164; Morel, 1873, p. xy ",\N,\N,\N,\N,\N,\N,\N,\N,"42","46"
"265","2","2","10",\N,\N,"Escher joined the group. ","scene 42: ZÜRICH","Sorry, I could not avoid listening to your conversation. Love, liberty, ... Can you hear yourself? It almost sounds as if we, the liberals had been rouug conquerors of poor village people. Our true ""guilt"" had been to be too timid, hesitating all the time, going for and backwards. The conservatives were no innocent victims. Or had you seriously wished the Jesuits returned to the schools; mistaking teaching with blind recitation of the Bible?","Chronology scene 168; Morel, 1873, p. xy ",\N,\N,\N,\N,\N,\N,\N,\N,"43","47"
"266","2","2","11",\N,\N,\N,"scene 43: WINTERTHUR","Hi, Alfred! Nice to meet you again. You are so right. It had to be said that we too defended our faith. Those who opposed the Jesuits were also the ""people"". Hesitating could be as dammaging as a too quick and thoughless action.","Chronology scene 180; Morel, 1873, p. xy ",\N,\N,\N,\N,\N,\N,\N,\N,"44","48"
"267","2","2","9",\N,\N,\N,"scene 44: LUZERN","Please, comme on! From your mouth it sounds as if the Sonderbund was a football game. People had died! I had lost all my goods and I had to live ten years in exile, with all my family. This was no children's game!","Chronology scene 173; Morel, 1873, p. xy ",\N,\N,\N,\N,\N,\N,\N,\N,"45","49"
"268","2","2","10",\N,\N,\N,"scene 45: ZÜRICH","Alfred, I know you, we sat often together. Don't tell me now that you worried for the ""faith"" of the liberals. You only longed for money and power.","Chronology scene 172, 184; Morel, 1873, p. xy ",\N,\N,\N,\N,\N,\N,\N,\N,"46","50"
"269","2","2","12",\N,\N,\N,"scene 46: TEXAS","Karl, who had keep silence so far so how Alfred got more and more stressed. He layed his hand on Alfred's shoulder and said: Why are you fighting? What are you fighting for? Liberty, the people? Everybody was fighting for this in Europe. And this was nothing! I was in Texas, there they even treated some people worse than animals. Our, the Swiss merit was that we had found a way to live with our opponents, besides unsolved conflicts.","Chronology scene ??; Morel, 1873, p. xy ",\N,\N,\N,\N,\N,\N,\N,\N,"47","51"
"270","2","2","12",\N,\N,\N,"scene 47: TEXAS","I had wished a socialist state; the Phalange. That's why I joined in to the idea of direct democracy.","Chronology scene ??; Morel, 1873, p. xy ",\N,\N,\N,\N,\N,\N,\N,\N,"48","52"
"271","2","2","9",\N,\N,\N,"scene 48: GERMANY","You are right, Karl. I had always tried to find a compromise. This is probabely the reason why the let me return to Switzerland towards the end, and why I was able to forgive.","Chronology scene 255-256, 295; Morel, 1873, p. xy ",\N,\N,\N,\N,\N,\N,\N,\N,"49","53"
"272","2","2","9",\N,\N,\N,"scene 49: GERMANY","But the past had learnet me something, that at times one was forced to take a decision. Failing to do so, would also lead to a decision, but it would stay out of your control. My wrong decisions had only brought me closer to my God. He would bring the reign of God one day.","Chronology scene 311, 313, 319; Morel, 1873, p. xy ",\N,\N,\N,\N,\N,\N,\N,\N,"50","54"
"273","2","4","13",\N,\N,\N,"scene 50: HIRZEL","The reign of God was not of this world.","Chronology scene 220; Morel, 1873, p. xy ",\N,\N,\N,\N,\N,\N,\N,\N,"51","55"
"274","2","10","14",\N,\N,\N,"scene 51: PARIS","This is exactly what I thought. It's all illusion, all Maya. At the end, why fighting any longer. I just couldn't anymore. There was nothing that expected me in life. This is why united with my grand love Marie, my Virign, we took our lives.","Chronology scene 242; Morel, 1873, p. xy ",\N,\N,\N,\N,\N,\N,\N,\N,"52","56"
"275","2","16","8",\N,\N,\N,"scene 52: LUZERN","Don't say this. I have fought so much. But all achieving is nothing, because at the end you will not take it with anyway. I learnt that I had to leave something behind. Haven't cared, Bernhard, for finishing your Sanskrit books before leaving this world? Don't be a hypocrite!","Chronology scene 235; Morel, 1873, p. xy ",\N,\N,\N,\N,\N,\N,\N,\N,"53","57"
"276","2","22","15",\N,\N,\N,"scene 53: GENEVA","This is why we from the First International and the Women's Movement did not go the way of violence. And no-one could ever say, that I feared a good fight. But that would not lead to the liberty we desired.","Chronology scene 309, 317, 318, 325; Morel, 1873, p. xy ",\N,\N,\N,\N,\N,\N,\N,\N,"54","58"
"277","2","28","10",\N,\N,\N,"scene 54: ZÜRICH","You sound like those crazy ""Schwärmer"". If you go on like this you will end as Bernhard did - believing all is an illusion. There are decision which had to be taken.","Chronology scene 339; Morel, 1873, p. xy ",\N,\N,\N,\N,\N,\N,\N,\N,"55","59"
"278","2","34","12",\N,\N,\N,"scene 55: ZÜRICH","And we took them. Yes, we did, but each of us according his or her own consciousness.","Chronology scene 308, 318; Morel, 1873, p. xy ",\N,\N,\N,\N,\N,\N,\N,\N,"56","60"
"279","2","40","10",\N,\N,\N,"scene 56: ZÜRICH","But there must be one truly right decision.","Chronology scene 248-254; Morel, 1873, p. xy ",\N,\N,\N,\N,\N,\N,\N,\N,"57","61"
"280","2","46","12",\N,\N,\N,"scene 57: ZÜRICH","Yes, there was one. The one that included us all.",\N,\N,\N,\N,\N,\N,\N,\N,\N,"58","62"
